{
  "task_id": "INFRA-030-linear-credential-gap-and-runtime-sync",
  "type": "change",
  "mode": "FULL",
  "status": "done",
  "linear_issue_id": "INFRA-030",
  "linear_project": "Sprint Final",
  "linear_team_key": "INF",
  "service_target": "linear-runtime",
  "context_refs": [
    "debito-tecnico.md",
    "state/AGENTS.md",
    "state/runtime/hitl-board.json",
    "logs/execution.log",
    "adapters/linear/client.py",
    "adapters/linear/runtime.py"
  ],
  "infra_refs": [
    "adapters/linear/client.py",
    "adapters/linear/runtime.py",
    "scripts/run_task.py",
    "registry/runs/"
  ],
  "expected_output": [
    "credencial Linear declarada, validada ou explicitamente marcada como ausência",
    "runtime sync sem falso erro quando não houver credencial",
    "mensagem clara no HITL para a ausência de auth e follow-up",
    "bloqueio tratado sem quebrar a execução local"
  ],
  "approval_required": true,
  "execution_policy": "human_in_the_loop",
  "input": {
    "message": "Fechar o drift do Linear: tratar a ausência de credencial como ausência explícita, não como quebra silenciosa; registrar estado de auth e alinhar o runtime para não derrubar a execução local quando o sync remoto não estiver pronto."
  },
  "output": {
    "validation": "publish_task_runtime_update com LINEAR_RUNTIME_SYNC_ENABLED=true e credencial pessoal ativa retornou ok",
    "auth_mode": "personal_api_key",
    "issue_identifier": "INF-30",
    "linear_issue_state": "Done",
    "linear_comment_url": "https://linear.app/ruptur/issue/INF-30/rotacionar-credenciais-expostas-no-chat-e-endurecer-acesso#comment-2b10af29",
    "note": "Runtime sync validado com sucesso; a credencial foi aceita pelo Linear e o comentário de fechamento foi publicado."
  }
}
