{
  "task_id": "INFRA-027-sprint-final-sessao-login-observabilidade-seguranca",
  "type": "change",
  "mode": "FULL",
  "status": "pending",
  "linear_issue_id": "INFRA-027",
  "linear_project": "Sprint Final",
  "linear_team_key": "INF",
  "service_target": "agent-hub",
  "context_refs": [
    "debito-tecnico.md",
    "debitos-tecnicos.md",
    "mapa-de-infra-e-projetos-e-debitos.md",
    "state/AGENTS.md",
    "state/runtime/hitl-board.json",
    "state/registry/hitl-sources.json",
    "../saas/web/dashboard-dist/metrics.html",
    "../saas/modules/warmup-core/server.mjs"
  ],
  "infra_refs": [
    "adapters/memory/",
    "adapters/provisioning/ansible/",
    "scripts/build_hitl_board.py",
    "state/runtime/hitl-board.json",
    "../saas/web/dashboard-dist/hitl-board.json"
  ],
  "expected_output": [
    "arquitetura de sessão e login padronizada com Redis e cookies seguros",
    "observabilidade com logs, métricas e traces correlacionados",
    "controles de segurança para evitar sessão indevida e logoff inconsistente",
    "backlog confirmado como sprint final após os impedimentos e débitos técnicos",
    "impedimento formal de pronto do projeto até haver solução ou decisão registrada"
  ],
  "approval_required": true,
  "execution_policy": "human_in_the_loop",
  "input": {
    "message": "Guardar para a sprint final a implementação de sessão, login, logout, segurança e observabilidade do Agent Hub/HITL, somente depois de concluir as tasks que estão em débito técnico, bugs e impedimentos. A entrega deve cobrir Redis como session store, cookie seguro, revogação, auditoria, telemetria e logs correlacionados. Este item é impedimento formal para marcar o projeto como pronto; pode ser revisto e modificado, mas não pode ser esquecido nem removido sem decisão explícita registrada."
  },
  "output": {}
}
